{
    "$schema": "../../schemas/official-event.schema.json",

    "slug": "esl-impact-cashcup-eu-2022-summer-1",
    "name": "ESL Impact Cash Cup: Europe - Summer 2022 #1",
    "duration": { "start": "2022-06-25", "end": "2022-06-26" },
    "links": [
        { "name": "Liquipedia", "url": "https://liquipedia.net/counterstrike/ESL/Impact_Cash_Cup/Europe/2022/Summer/1" },
        { "name": "ESEA", "url": "https://play.esea.net/events/1624" },
        { "name": "Brackets", "url": "https://play.esea.net/index.php?s=events&d=brackets&id=1624" },
        { "name": "HLTV", "url": "https://www.hltv.org/events/6635/esl-impact-summer-2022-cash-cup-1-europe" }
    ],
    "tags": ["impact"],
    "participants": [{ "shorthand": "nsc", "lineup": { "roster": "nsc-2021-2" } }],
    "brackets": [
        {
            "slug": "r1",
            "name": "Round 1",
            "matches": [
                {
                    "id": 1,
                    "date": "2022-06-25",
                    "lineups": { "team1": { "shorthand": "nsc" }, "team2": { "name": "Pandaric Winx" } },
                    "maps": [{ "id": 1, "map": "ovp", "result": "16:4", "links": [{ "name": "ESEA", "url": "https://play.esea.net/match/16937246" }] }]
                }
            ]
        },
        {
            "slug": "r2",
            "name": "Round 2",
            "matches": [
                {
                    "id": 1,
                    "date": "2022-06-25",
                    "lineups": { "team1": { "shorthand": "nsc" }, "team2": { "name": "FIFTYFIVEPOWER" } },
                    "maps": [{ "id": 1, "map": "ovp", "result": "16:4", "links": [{ "name": "ESEA", "url": "https://play.esea.net/match/16937268" }] }]
                }
            ]
        },
        {
            "slug": "r3",
            "name": "Round 3",
            "matches": [
                {
                    "id": 1,
                    "date": "2022-06-26",
                    "lineups": { "team1": { "shorthand": "nsc" }, "team2": { "name": "MostValuablePlayers" } },
                    "maps": [
                        { "id": 1, "map": "inf", "result": "16:14", "links": [{ "name": "ESEA", "url": "https://play.esea.net/match/16937300" }] },
                        { "id": 2, "map": "ovp", "result": "10:16", "links": [{ "name": "ESEA", "url": "https://play.esea.net/match/16937326" }] },
                        { "id": 3, "map": "d2", "result": "8:16", "links": [{ "name": "ESEA", "url": "https://play.esea.net/match/16937348" }] }
                    ]
                }
            ]
        }
    ]
}
