{
    "$schema": "../../schemas/official-event.schema.json",

    "slug": "esl-impact-cashcup-eu-2022-autumn-1",
    "name": "ESL Impact Cash Cup: Europe - Autumn 2022 #1",
    "duration": { "start": "2022-09-24", "end": "2022-09-25" },
    "links": [
        { "name": "Liquip.", "url": "https://liquipedia.net/counterstrike/ESL/Impact_Cash_Cup/Europe/2022/Autumn/1" },
        { "name": "ESEA", "url": "https://play.esea.net/events/1969" },
        { "name": "Brackets", "url": "https://play.esea.net/index.php?s=events&d=brackets&id=1969" },
        { "name": "HLTV", "url": "https://www.hltv.org/events/6820/esl-impact-autumn-2022-cash-cup-1-europe" }
    ],
    "tags": ["impact"],
    "participants": [{ "shorthand": "cfs", "lineup": { "roster": "cfs-2022-2" } }],
    "brackets": [
        {
            "slug": "r2",
            "name": "R2",
            "matches": [
                {
                    "id": 1,
                    "date": "2022-09-24",
                    "lineups": { "team1": { "shorthand": "cfs" }, "team2": { "name": "The Elements" } },
                    "maps": [{ "id": 1, "map": "vtg", "result": "16:1", "links": [{ "name": "ESEA", "url": "https://play.esea.net/match/16980247" }] }]
                }
            ]
        },
        {
            "slug": "r3",
            "name": "R3",
            "matches": [
                {
                    "id": 1,
                    "date": "2022-09-25",
                    "lineups": { "team1": { "shorthand": "cfs" }, "team2": { "name": "NOFEAR5" } },
                    "maps": [
                        { "id": 1, "map": "inf", "result": "11:16", "links": [{ "name": "ESEA", "url": "https://play.esea.net/match/16980269" }] },
                        { "id": 2, "map": "vtg", "result": "16:6", "links": [{ "name": "ESEA", "url": "https://play.esea.net/match/16980291" }] },
                        { "id": 3, "map": "ovp", "result": "16:10", "links": [{ "name": "ESEA", "url": "https://play.esea.net/match/16980309" }] }
                    ]
                }
            ]
        },
        {
            "slug": "r4",
            "name": "R4",
            "matches": [
                {
                    "id": 1,
                    "date": "2022-09-25",
                    "lineups": { "team1": { "shorthand": "cfs" }, "team2": { "name": "MostValuablePlayers" } },
                    "links": [{ "name": "HLTV", "url": "https://www.hltv.org/matches/2359189/flames-shieldmaidens-vs-mvp-esl-impact-autumn-2022-cash-cup-1-europe" }],
                    "maps": [
                        { "id": 1, "map": "mrg", "result": "10:16", "links": [{ "name": "ESEA", "url": "https://play.esea.net/match/16980554" }] },
                        { "id": 2, "map": "nuke", "result": "8:16", "links": [{ "name": "ESEA", "url": "https://play.esea.net/match/16980587" }] }
                    ]
                }
            ]
        }
    ]
}
