{
    "$schema": "../../schemas/official-event.schema.json",

    "slug": "esl-impact-cashcup-eu-2022-spring-5",
    "name": "ESL Impact Cash Cup: Europe - Spring 2022 #5",
    "duration": { "start": "2022-06-04", "end": "2022-06-05" },
    "links": [
        { "name": "Liquipedia", "url": "https://liquipedia.net/counterstrike/ESL/Impact_Cash_Cup/Europe/2022/Spring/5" },
        { "name": "ESEA", "url": "https://play.esea.net/events/1439" },
        { "name": "Brackets", "url": "https://play.esea.net/index.php?s=events&d=brackets&id=1439" },
        { "name": "HLTV", "url": "https://www.hltv.org/events/6608/esl-impact-spring-2022-cash-cup-5-europe" }
    ],
    "tags": ["impact"],
    "participants": [{ "shorthand": "nsc", "lineup": { "roster": "nsc-2021-2" } }],
    "brackets": [
        {
            "slug": "r2",
            "name": "Round 2",
            "matches": [
                {
                    "id": 8,
                    "date": "2022-06-04",
                    "lineups": { "team1": { "name": "Fat Pickles" }, "team2": { "shorthand": "nsc" } },
                    "maps": [{ "id": 1, "map": "ovp", "result": "13:16", "links": [{ "name": "ESEA", "url": "https://play.esea.net/match/16927718" }] }]
                }
            ]
        },
        {
            "slug": "r3",
            "name": "Round 3",
            "matches": [
                {
                    "id": 4,
                    "date": "2022-06-04",
                    "lineups": { "team1": { "name": "Illusion" }, "team2": { "shorthand": "nsc" } },
                    "maps": [{ "id": 1, "map": "nuke", "result": "14:16", "links": [{ "name": "ESEA", "url": "https://play.esea.net/match/16927729" }] }]
                }
            ]
        },
        {
            "slug": "r4",
            "name": "Round 4",
            "matches": [
                {
                    "id": 2,
                    "date": "2022-06-05",
                    "lineups": { "team1": { "name": "Entropiq Queens" }, "team2": { "shorthand": "nsc" } },
                    "maps": [],
                    "note": "Entropiq Queens forfeited the match."
                }
            ]
        },
        {
            "slug": "r5",
            "name": "Round 5",
            "matches": [
                {
                    "id": 1,
                    "date": "2022-06-05",
                    "lineups": { "team1": { "name": "NAVI Javelins" }, "team2": { "shorthand": "nsc" } },
                    "links": [{ "name": "HLTV", "url": "https://www.hltv.org/matches/2356718/navi-javelins-vs-nsc-esl-impact-spring-2022-cash-cup-5-europe" }],
                    "maps": [
                        { "id": 1, "map": "inf", "result": "12:16", "links": [{ "name": "ESEA", "url": "https://play.esea.net/match/16928096" }] },
                        { "id": 2, "map": "nuke", "result": "16:8", "links": [{ "name": "ESEA", "url": "https://play.esea.net/match/16928117" }] },
                        { "id": 3, "map": "vtg", "result": "16:12", "links": [{ "name": "ESEA", "url": "https://play.esea.net/match/16928139" }] }
                    ]
                }
            ]
        }
    ]
}
