{
    "$schema": "../../schemas/official-event.schema.json",

    "slug": "esl-impact-cashcup-eu-2022-autumn-6",
    "name": "ESL Impact Cash Cup: Europe - Autumn 2022 #6",
    "duration": { "start": "2022-12-10", "end": "2022-12-11" },
    "links": [
        { "name": "L.p.", "url": "https://liquipedia.net/counterstrike/ESL/Impact_Cash_Cup/Europe/2022/Autumn/6" },
        { "name": "ESEA", "url": "https://play.esea.net/events/2085" },
        { "name": "Brackets", "url": "https://play.esea.net/index.php?s=events&d=brackets&id=2085" }
    ],
    "tags": ["impact"],
    "participants": [{ "shorthand": "cfs", "lineup": { "roster": "cfs-2022-2", "coach": "carnem" } }],
    "brackets": [
        {
            "slug": "r2",
            "name": "R2",
            "matches": [
                {
                    "id": 5,
                    "date": "2022-12-10",
                    "lineups": { "team1": { "shorthand": "cfs" }, "team2": { "name": "Team Lótus" } },
                    "maps": [{ "id": 1, "map": "anc", "result": "16:9", "links": [{ "name": "ESEA", "url": "https://play.esea.net/match/17009449" }] }]
                }
            ]
        },
        {
            "slug": "r3",
            "name": "R3",
            "matches": [
                {
                    "id": 3,
                    "date": "2022-12-10",
                    "lineups": { "team1": { "shorthand": "cfs" }, "team2": { "name": "Insilio Female" } },
                    "maps": [{ "id": 1, "map": "anc", "result": "16:13", "links": [{ "name": "ESEA", "url": "https://play.esea.net/match/17009477" }] }]
                }
            ]
        },
        {
            "slug": "r4",
            "name": "R4",
            "matches": [
                {
                    "id": 2,
                    "date": "2022-12-11",
                    "lineups": { "team1": { "shorthand": "cfs" }, "team2": { "name": "Angels" } },
                    "maps": [
                        { "id": 1, "map": "nuke", "result": "16:14", "links": [{ "name": "ESEA", "url": "https://play.esea.net/match/17009747" }] },
                        { "id": 2, "map": "vtg", "result": "22:20", "links": [{ "name": "ESEA", "url": "https://play.esea.net/match/17009759" }] }
                    ]
                }
            ]
        },
        {
            "slug": "r5",
            "name": "R5",
            "matches": [
                {
                    "id": 1,
                    "date": "2022-12-11",
                    "lineups": { "team1": { "name": "shinigami" }, "team2": { "shorthand": "cfs" } },
                    "maps": [
                        { "id": 1, "map": "anc", "result": "14:16", "links": [{ "name": "ESEA", "url": "https://play.esea.net/match/17009768" }] },
                        { "id": 2, "map": "vtg", "result": "12:16", "links": [{ "name": "ESEA", "url": "https://play.esea.net/match/17009783" }] }
                    ]
                }
            ]
        }
    ]
}
