{
    "$schema": "../../schemas/official-event.schema.json",

    "slug": "cct-s1-eu-e-s1",
    "name": "CCT Season 1 East Europe Series #1",
    "duration": { "start": "2023-07-29", "end": "2023-08-20" },
    "links": [
        { "name": "L.p.", "url": "https://liquipedia.net/counterstrike/CCT/Season_1/East_Europe/Series_1" },
        { "name": "CCT", "url": "https://cctour.gg/tournaments/cct-east-europe" },
        { "name": "Rules", "url": "https://docs.google.com/document/d/1fTQRUN0IR9Q9bEhyI35for61D7J7k1gRLQG22zk-l78/edit" }
    ],
    "participants": [{ "shorthand": "nipi", "lineup": { "roster": "nipi-2023-2" } }],
    "brackets": [
        {
            "slug": "s2",
            "name": "Closed Q.",
            "links": [{ "name": "L.p.", "url": "https://liquipedia.net/counterstrike/CCT/Season_1/East_Europe/Series_1/Qualifier" }],
            "brackets": [
                {
                    "slug": "s1--group-stage",
                    "brackets": [
                        {
                            "slug": "gc",
                            "name": "Group C",
                            "matches": [
                                {
                                    "id": 2,
                                    "name": "Opening Match 2",
                                    "date": "2023-08-03",
                                    "lineups": { "team1": { "name": "Natus Vincere Youth" }, "team2": { "shorthand": "nipi" } },
                                    "links": [{ "name": "Bo3.gg", "url": "https://bo3.gg/matches/navi-youth-vs-ninjas-in-pyjamas-female-03-08-2023" }],
                                    "maps": [
                                        { "id": 1, "map": "mrg", "result": "16:3" },
                                        { "id": 2, "map": "ovp", "result": "16:10" }
                                    ]
                                },
                                {
                                    "id": 4,
                                    "name": "Elimination Match",
                                    "date": "2023-08-04",
                                    "lineups": { "team1": { "name": "BALLIST" }, "team2": { "shorthand": "nipi" } },
                                    "maps": [],
                                    "note": "BALLIST forfeited the match."
                                },
                                {
                                    "id": 1,
                                    "name": "Decider Match",
                                    "date": "2023-08-04",
                                    "lineups": { "team1": { "name": "Singularity" }, "team2": { "shorthand": "nipi" } },
                                    "links": [{ "name": "Bo3.gg", "url": "https://bo3.gg/matches/singularity-cs-go-vs-ninjas-in-pyjamas-female-04-08-2023" }],
                                    "maps": [
                                        { "id": 1, "map": "nuke", "result": "16:11" },
                                        { "id": 2, "map": "ovp", "result": "16:1" }
                                    ]
                                }
                            ]
                        }
                    ]
                }
            ]
        }
    ]
}
