{
    "$schema": "../../schemas/official-event.schema.json",

    "slug": "faceit-loyalty-2020-05-01",
    "name": "FACEIT Loyalty Series 2020-05-01",
    "duration": { "start": "2020-05-01", "end": "2020-05-01" },
    "links": [{ "name": "FACEIT", "url": "https://www.faceit.com/en/championship/bc42499b-8e9c-475b-8ce6-80bab70fbf06" }],
    "participants": [{ "shorthand": "n", "lineup": { "name": "ExitLife", "players": ["nayomy"] } }],
    "brackets": [
        {
            "slug": "r1",
            "name": "Round of 16",
            "matches": [
                {
                    "id": 2,
                    "date": "2020-05-01",
                    "lineups": { "team1": { "shorthand": "n" }, "team2": { "name": "Team cheapicetea" } },
                    "links": [{ "name": "FACEIT", "url": "https://www.faceit.com/en/csgo/room/1-c40fe57e-2dd8-4026-9ae0-6891bf991514" }],
                    "maps": [{ "id": 1, "map": "inf", "result": "19:17" }]
                }
            ]
        },
        {
            "slug": "r2",
            "name": "Quarterfinals",
            "matches": [
                {
                    "id": 1,
                    "date": "2020-05-01",
                    "lineups": { "team1": { "name": "NotCheatsBro" }, "team2": { "shorthand": "n" } },
                    "links": [{ "name": "FACEIT", "url": "https://www.faceit.com/en/csgo/room/1-6865c83b-abd5-4e99-9178-09da344b9bcb" }],
                    "maps": [{ "id": 1, "map": "mrg", "result": "6:16" }]
                }
            ]
        }
    ]
}
