{
    "$schema": "../../schemas/official-event.schema.json",

    "slug": "esports-nations-cup-2026",
    "name": "Esports Nations Cup 2026",
    "duration": { "start": "2026-07-06", "end": "2026-11-15" },
    "links": [
        { "name": "ENC", "url": "https://esportsnationscup.com/en/competitions/2026/cs2" },
        { "name": "L.p.", "url": "https://liquipedia.net/counterstrike/Esports_Nations_Cup/2026" }
    ],
    "participants": [{ "shorthand": "kna", "lineup": { "name": "Kan niet anders", "players": ["d0cc", "kd69z", "nayomy", "neok", "qiyarah"] } }],
    "brackets": [
        {
            "slug": "s1--national-qualifers",
            "duration": { "start": "2026-07-06", "end": "2026-07-16" },
            "brackets": [
                {
                    "slug": "nl",
                    "name": "Netherlands Qualifier",
                    "links": [{ "name": "FACEIT", "url": "https://www.faceit.com/en/championship/0fcad12f-c05d-45ad-bde0-e4a2e85246a4" }],
                    "brackets": [
                        {
                            "slug": "r1",
                            "name": "Quarterfinals",
                            "matches": [
                                {
                                    "id": 3,
                                    "date": "2026-07-09",
                                    "lineups": { "team1": { "shorthand": "kna" }, "team2": { "name": "Fnepic" } },
                                    "links": [{ "name": "FACEIT", "url": "https://www.faceit.com/en/cs2/room/1-82c5489c-fc06-4979-9b6a-4fd80128db96" }],
                                    "maps": [
                                        {
                                            "id": 1,
                                            "map": "nuke",
                                            "result": "13:3",
                                            "rewatches": [
                                                {
                                                    "language": "en",
                                                    "casters": ["litmus"],
                                                    "parts": [{ "link": { "name": "Twitch", "url": "https://www.twitch.tv/videos/2815835154" }, "duration": "00:00:00-00:34:54" }]
                                                }
                                            ]
                                        },
                                        {
                                            "id": 2,
                                            "map": "mrg",
                                            "result": "13:2",
                                            "rewatches": [
                                                {
                                                    "language": "en",
                                                    "casters": ["litmus"],
                                                    "parts": [{ "link": { "name": "Twitch", "url": "https://www.twitch.tv/videos/2815835154" }, "duration": "00:43:13-01:04:13" }]
                                                }
                                            ]
                                        }
                                    ]
                                }
                            ]
                        },
                        {
                            "slug": "r2",
                            "name": "Semifinals",
                            "matches": [
                                {
                                    "id": 2,
                                    "date": "2026-07-09",
                                    "lineups": { "team1": { "shorthand": "kna" }, "team2": { "name": "Team g1do" } },
                                    "links": [{ "name": "FACEIT", "url": "https://www.faceit.com/en/cs2/room/1-68358b26-7e44-4c35-be1c-1a3e86f2c85f" }],
                                    "maps": [
                                        {
                                            "id": 1,
                                            "map": "inf",
                                            "result": "13:6",
                                            "rewatches": [
                                                {
                                                    "language": "en",
                                                    "casters": ["litmus"],
                                                    "parts": [{ "link": { "name": "Twitch", "url": "https://www.twitch.tv/videos/2815835154" }, "duration": "01:50:06-02:35:45" }]
                                                }
                                            ]
                                        },
                                        {
                                            "id": 2,
                                            "map": "mrg",
                                            "result": "13:7",
                                            "rewatches": [
                                                {
                                                    "language": "en",
                                                    "casters": ["litmus"],
                                                    "parts": [
                                                        { "link": { "name": "Twitch", "url": "https://www.twitch.tv/videos/2815835154" }, "duration": "02:38:51-03:18:30" },
                                                        { "link": { "name": "Interview", "url": "https://www.twitch.tv/videos/2815835154" }, "duration": "03:24:01-03:33:06" }
                                                    ]
                                                }
                                            ]
                                        }
                                    ]
                                }
                            ]
                        },
                        {
                            "slug": "r3--grand-final",
                            "matches": [
                                {
                                    "id": 1,
                                    "name": "Grand Final",
                                    "date": "2026-07-10",
                                    "lineups": { "team1": { "name": "Team Netherlands" }, "team2": { "shorthand": "kna" } },
                                    "links": [{ "name": "FACEIT", "url": "https://www.faceit.com/en/cs2/room/1-bb99ebe4-700b-4f79-8687-dd63ab1b0e93" }],
                                    "maps": []
                                }
                            ]
                        }
                    ]
                }
            ]
        },
        { "slug": "s2--regional-qualifiers", "brackets": [{ "slug": "euw", "name": "Europe West" }] },
        { "slug": "s3--main-event", "duration": { "start": "2026-11-10", "end": "2026-11-15" } }
    ]
}
